user_name,user_nfollower,vid_id,vid_caption,vid_postTime,vid_scrapeTime,vid_duration,vid_nview,vid_nlike,vid_ncomment,vid_nshare,vid_nsave,vid_hashtags,vid_url,music_id,music_title,music_nused,music_authorName,music_originality
tranbom.vcu,229.5K,7501339010531429640,Sợ Vợ Award,2025-05-06 14:26:30,2025-06-05 23:51:39,01:24,159.7K,11.1K,111,1920,179,"tranbom, fyp, foryourpage, tiktok",https://www.tiktok.com/@tranbom.vcu/video/7501339010531429640,7501339130636208912,,,Trần Bơm,true
tranbom.vcu,229.5K,7500595624077774087,Nhớ mãi không quên 🩷,2025-05-04 14:21:46,2025-06-05 23:52:09,00:45,114.1K,6279,101,887,77,"tranbom, fyp, foryourpage, tiktok",https://www.tiktok.com/@tranbom.vcu/video/7500595624077774087,7500595750200511248,,,Trần Bơm,true
tranbom.vcu,229.5K,7500209863927123218,Chuyện chưa kể,2025-05-03 13:24:50,2025-06-05 23:52:36,01:19,206.7K,17.9K,199,2407,303,"tranbom, fyp, foryourpage, tiktok",https://www.tiktok.com/@tranbom.vcu/video/7500209863927123218,7500210062196050689,,,Trần Bơm,true
tranbom.vcu,229.5K,7499869003112860936,Teamwork đỉnh cao 💪🏻,2025-05-02 15:22:07,2025-06-05 23:53:04,00:45,809.3K,68.1K,960,13.8K,1413,"tranbom, fyp, foryourpage, tiktok",https://www.tiktok.com/@tranbom.vcu/video/7499869003112860936,7499869134282607377,,,Trần Bơm,true
tranbom.vcu,229.5K,7499507951594622215,Từ chối bình yên,2025-05-01 16:01:03,2025-06-05 23:53:35,01:07,483.4K,43.3K,638,11.8K,1368,"tranbom, fyp, foryourpage, tiktok",https://www.tiktok.com/@tranbom.vcu/video/7499507951594622215,7499508123074317073,,,Trần Bơm,true
tranbom.vcu,229.5K,7498345133562203410,Chuyện tâm linh,2025-04-28 12:48:43,2025-06-05 23:54:00,00:56,170.2K,10.7K,110,623,102,"tranbom, fyp, foryourpage, tiktok",https://www.tiktok.com/@tranbom.vcu/video/7498345133562203410,7498345289951726353,nhạc nền - Trần Bơm,1 videos,Trần Bơm,true
tranbom.vcu,229.5K,7498000989664988423,Tiết kiệm,2025-04-27 14:33:16,2025-06-05 23:54:27,00:43,1.8M,94.2K,431,11.1K,1508,"tranbom, fyp, foryourpage, tiktok",https://www.tiktok.com/@tranbom.vcu/video/7498000989664988423,7498001109324253968,nhạc nền - Trần Bơm,1 videos,Trần Bơm,true
tranbom.vcu,229.5K,7497653984174378247,Khi tôi quên mật khẩu và AI biến thành người,2025-04-26 16:06:43,2025-06-05 23:54:54,02:52,1.6M,100.8K,754,11.2K,2365,"tranbom, fyp, foryourpage, tiktok",https://www.tiktok.com/@tranbom.vcu/video/7497653984174378247,7497654379873962769,nhạc nền - Trần Bơm,1 videos,Trần Bơm,true
nh._xinh,18.7K,7487155764126108983,Stylo 160cc nhập khẩu indo giá chỉ 6x nhỏ xíu,2025-03-29 09:08:15,2025-06-05 23:55:52,00:19,14.2K,152,20,10,17,"xedo, xedep, xuhuong, xuhuongtiktok, vairal, stylo160, stylo, 2025, hottrend, hot, nhưxemay, xemaytragopbinhduong, xedovietnam, binhduong, bencat",https://www.tiktok.com/@nh._xinh/video/7487155764126108983,7454547839708826384,,5008 videos,𝐇𝐨à𝐧𝐠 Ú𝐭 𝐌𝐮𝐬𝐢𝐜 ✈,false
nh._xinh,18.7K,7488272086981430583,Vario 125 xám titan chỉ 38 củ không cần trả trước 😍 ✅0393✅022✅961 Như tư vấn,2025-04-01 09:20:09,2025-06-05 23:56:18,00:15,44.6K,1143,35,57,152,"xedo, xedep, xuhuong, xuhuongtiktok, vairal, 2025, hottrend, hot, nhưxemay, xemaytragopbinhduong, vario, bencat, binhduong",https://www.tiktok.com/@nh._xinh/video/7488272086981430583,7486854083606366982,,,𝐕𝐢𝐞 𝐂𝐨𝐧𝐟𝐢𝐝𝐞,false
nh._xinh,18.7K,7488308534954741047,Vario 125 trắng ngọc trinh lên full đèn ae cho ý kiến 😋✅0398✅022✅961 Như,2025-04-01 11:41:36,2025-06-05 23:56:45,00:14,3.5M,160.7K,939,4347,12.7K,"xedo, xedep, xuhuong, xuhuongtiktok, vairal, 2025, hottrend, hot, nhưxemay, vario, binhduong, bencat, xedovietnam",https://www.tiktok.com/@nh._xinh/video/7488308534954741047,7016183582221814555,,,Phát Huy T4 🎤,false
nh._xinh,18.7K,7488686886148443398,Sh 160 đỏ loang đen 2025 màu hót cho ae 😉,2025-04-02 12:09:47,2025-06-05 23:57:12,00:18,30.7K,757,47,33,115,"xedo, xedep, xuhuong, xuhuongtiktok, vairal, sh, sh125, sh160, 2025, nhưxemay, xemaytragopbinhduong, xedovietnam, binhduong, virus, ngockem",https://www.tiktok.com/@nh._xinh/video/7488686886148443398,7293424279739173634,,,Xàm🫀,false
nh._xinh,18.7K,7489411681475480838,Vision xanh candy độ kiểng kèm full đèn Tư vấn ✅0398✅022✅961 Như tư vấn,2025-04-04 11:02:22,2025-06-05 23:57:39,00:18,37.5K,812,12,24,84,"xedo, xedep, xuhuong, xuhuongtiktok, vairal, vision, sh125, sh, 2025, nhưxemay, xemaytragopbinhduong, binhduong",https://www.tiktok.com/@nh._xinh/video/7489411681475480838,7040230686753950465,nhạc nền - 𝙄𝙏𝘿.𝘼𝙣𝙝𝙌𝙪𝙖̂𝙣♻,41.5K videos,⚜️𝓛𝓸𝓾𝓲𝓼⚜️,false
nh._xinh,18.7K,7491638461623962887,Sh 160 Xanh đen candy chỉ 93củ | ✅0398✅022✅961,2025-04-10 11:03:25,2025-06-05 23:58:06,00:22,11K,210,20,13,33,"xedo, xedep, xuhuong, xuhuongtiktok, vairal, sh125, sh, sh160, binhduong, nhưxemay, 2025, xemaytragopbinhduong, binhduong, hot",https://www.tiktok.com/@nh._xinh/video/7491638461623962887,7487461004882414342,nhạc nền - 𝐕𝐚𝐧𝐊𝐡𝐚𝐧𝐠,77K videos,𝐕𝐚𝐧𝐊𝐡𝐚𝐧𝐠,false
nh._xinh,18.7K,7492997009335520530,Vario 125 2024 Lên áo Click thái chỉ 4x nhỏ xíu | Ship de xe toàn quốc | Hỗ trợ trả góp,2025-04-14 02:55:16,2025-06-05 23:58:32,00:18,1.3M,116.5K,360,3513,9821,"xedo, xedep, xuhuong, xuhuongtiktok, vairal, binhduong, nhưxemay, xemaytragopbinhduong, 2025, hottrend, vario, vario125",https://www.tiktok.com/@nh._xinh/video/7492997009335520530,7375853546975136529,nhạc nền - Jerry,109.6K videos,Jerry,false
nh._xinh,18.7K,7496353058268515592,Sh 125 hay Sh 160 🙈 Màu tím loang đen đang hót anh chị đã biết chưa liên hệ ngay em Như ✅398.022.961 da lô,2025-04-23 03:58:27,2025-06-05 23:59:15,00:16,95.6K,1666,105,149,217,"xedo, xedep, xuhuong, xuhuongtiktok, vairal, sh, sh125, sh160, nhưxemay, binhduong, xemaytragopbinhduong, 2025, hottrend",https://www.tiktok.com/@nh._xinh/video/7496353058268515592,7495010530110360336,,,Tạp hoá niềm vui,false
nh._xinh,18.7K,7496442071188884754,Sh bạc loang đen 2025 | Hỗ trợ trả hóp | Ship xe toàn quốc ✈️ Tư vấn ✅398.022.961 Như da lô,2025-04-23 09:43:52,2025-06-05 23:59:44,00:15,10.7K,268,44,33,48,"xedo, xedep, xuhuong, xuhuongtiktok, vairal, sh, sh125, sh160, nhưxemay, xemaytragopbinhduong, 2025, hottrend, hot",https://www.tiktok.com/@nh._xinh/video/7496442071188884754,7482387162768493329,nhạc nền - Vi Khánh Toàn 💫,71.5K videos,Vi Khánh Toàn 💫,false
nh._xinh,18.7K,7498688413349022983,Vario 125 Trắng đen 2025 giá chỉ 36củ | Hỗ trợ trả góp không cần trả trước 💕✅0398.022.961 Em Như,2025-04-29 11:00:49,2025-06-06 00:00:10,00:18,106.2K,2915,64,123,379,"xedo, xedep, xuhuong, xuhuongtiktok, vairal, vario, vario125, 2025, xemaytragopbinhduong, nhưxemay, hot, hottrend, varil, xedovietnam, vietnam, vietnamtoiyeu",https://www.tiktok.com/@nh._xinh/video/7498688413349022983,7403348913778232080,,,,false
nh._xinh,18.7K,7500815095954541832,Scoopy 110cc 2025 new chỉ 36củ500 cành | Ship toàn quốc ✈️,2025-05-05 04:33:26,2025-06-06 00:00:38,00:17,56.3K,673,34,54,71,"xedo, xedep, xuhuong, xuhuongtiktok, vairal, scoopy, xemaytragopbinhduong, hottrend, hot, xedovietnam, vietnamtoiyeu, binhduong, 2025",https://www.tiktok.com/@nh._xinh/video/7500815095954541832,7488342737480993542,,,,false
nh._xinh,18.7K,7501239816894336264,"Sh 125, Sh 160 Trắng xanh loang Sang - Xịn - Mịn | Ship xe toàn quốc ✈️✈️ Hỗ trợ trả góp ✅0398.022.961",2025-05-06 08:01:34,2025-06-06 00:01:08,00:20,115.9K,2524,119,200,345,"xedo, xedep, xuhuong, xuhuongtiktok, vairal, xemaytragopbinhduong, hottrend, hot, sh, sh125, sh160, vairal, trend, trending, xedovietnam, vietnamtoiyeu, 2025, binhduong",https://www.tiktok.com/@nh._xinh/video/7501239816894336264,7365454525479652112,nhạc nền - THANHPHONG - REMIX 🎶,128.7K videos,THANH PHONG REMIX,false
nh._xinh,18.7K,7501638496344493320,Vario 125 độ đèn demi. Ship xe toàn quốc ✈️ ✅0398.022.961 Như,2025-05-07 09:48:39,2025-06-06 00:01:40,00:22,516.5K,47K,265,3229,6725,"xedo, xedep, xuhuong, xuhuongtiktok, vairal, xemaytragopbinhduong, nhuxemay, hottrend, hot, vario, vario125, binhduong, trend, trending",https://www.tiktok.com/@nh._xinh/video/7501638496344493320,7468183908224682753,nhạc nền - 𝐇𝐨à𝐧𝐠 Ú𝐭 𝐌𝐮𝐬𝐢𝐜 ✈,91.7K videos,𝐇𝐨à𝐧𝐠 Ú𝐭 𝐌𝐮𝐬𝐢𝐜 ✈,false
nh._xinh,18.7K,7501913001918860552,"Scoopy 2025 Trắng đen Ship toàn quốc, Hỗ trợ trả góp",2025-05-08 03:33:52,2025-06-06 00:02:10,00:19,10.8K,151,25,12,20,"xedo, xedep, xuhuong, xuhuongtiktok, vairal, xemaytragopbinhduong, nhuxemay, hottrend, scoopy, scoopyindonesia, hot, trend, nhuxemaydaithanhcong, xedovietnam, 2025",https://www.tiktok.com/@nh._xinh/video/7501913001918860552,7460355577269816065,nhạc nền - Văn phường 98,174.9K videos,phường 98,false
nh._xinh,18.7K,7501935812871916808,Vario 125 Tím Hồng 3D màu đẹp mắt 👁️ ship xe toàn quốc,2025-05-08 05:02:23,2025-06-06 00:02:43,00:21,40K,3112,60,212,639,"xedo, xedep, xuhuong, xuhuongtiktok, vairal, xemaytragopbinhduong, nhuxemaydaithanhcong, hottrend, vario, vario125, 2025, trending, binhduong, hot, trend",https://www.tiktok.com/@nh._xinh/video/7501935812871916808,7469982230262958864,,,𝐇𝐨à𝐧𝐠 Ú𝐭 𝐌𝐮𝐬𝐢𝐜 ✈,false
nh._xinh,18.7K,7505349422692224263,Trả lời,2025-05-17 09:48:56,2025-06-06 00:03:18,00:18,65.7K,1773,113,100,194,"xedo, xedep, xuhuong, xuhuongtiktok, vairal, xemaytragopbinhduong, nhuxemaydaithanhcong, hottrend, sh, sh160, sh125",https://www.tiktok.com/@nh._xinh/video/7505349422692224263,7505349485925600016,,1 videos,Như _Xinh,true
nh._xinh,18.7K,7506518583581707528,Vario 125 Trắng loang vàng chỉ 3x | Ship toàn quốc ✈️| hỗ trợ trả góp không cần trả trước,2025-05-20 13:25:53,2025-06-06 00:03:53,00:15,9541,487,17,26,70,"xedo, xedep, xuhuong, xuhuongtiktok, vairal, xemaytragopbinhduong, nhuxemaydaithanhcong, hottrend, vario, vario125, 2025, trending, nhuxemay, hot",https://www.tiktok.com/@nh._xinh/video/7506518583581707528,7499696162270677777,,,♫ 𝑨 𝒏 𝒏 𝒊 𝒆  ᥫᩣ,false
nh._xinh,18.7K,7507083181166824722,Sh mode hồng đen đanh cho nữ 🥰Hỗ trợ trả góp | Ship xe toàn quốc ✈️,2025-05-22 01:56:49,2025-06-06 00:04:22,00:16,13.4K,613,37,28,99,"xedo, xedep, xuhuong, xuhuongtiktok, vairal, xemaytragopbinhduong, nhuxemaydaithanhcong, hottrend, sh, shmode, shmode2025, trending, binhduong",https://www.tiktok.com/@nh._xinh/video/7507083181166824722,7503900424416594705,,,Ông Minh Dance,false
nh._xinh,18.7K,7507132746729360647,Stylo 160 Xám đen titan Ship xe toàn quốc ✈️,2025-05-22 05:09:09,2025-06-06 00:04:47,00:21,2749,66,6,2,9,"xedo, xedep, xuhuong, xuhuongtiktok, vairal, nhuxemaydaithanhcong, xemaytragopbinhduong, hottrend, trending, binhduong, hot, stylo, stylo160",https://www.tiktok.com/@nh._xinh/video/7507132746729360647,7506850658545699601,,700 videos,Dj hyena99,false
bum.dai.chien,102.7K,7476102158459489543,Chuyện không kể lúc nữa đêm tập 3...! 🙄🙏🙏🙏,2025-02-27 14:14:37,2025-06-06 00:05:30,07:53,,53.8K,1862,4960,7220,"xanhsm, xanhcreator, bactaixanh, anh3bum",https://www.tiktok.com/@bum.dai.chien/video/7476102158459489543,7476102889246608144,,,,false
bum.dai.chien,102.7K,7476500277172931858,Chuyện không kể lúc nữa đêm...🙄🙏🙏🙏,2025-02-28 15:59:31,2025-06-06 00:05:58,03:52,,4804,214,223,492,"xanhsm, xanhcreator, xanhsmexpress, giaocatraitim, anh3bum",https://www.tiktok.com/@bum.dai.chien/video/7476500277172931858,7476500556673731329,,,,false
bum.dai.chien,102.7K,7476721708930714888,Hữu duyên xem clip thì đặt nhanh về sài luôn nha người đẹp😁🙏🙏🙏,2025-03-01 06:18:47,2025-06-06 00:06:30,00:00,,555,76,12,35,"anh3bum, xanhsm, bammongtay",https://www.tiktok.com/@bum.dai.chien/video/7476721708930714888,7476721746487003905,,,Anh 3 Bum,true
bum.dai.chien,102.7K,7477045857867615496,Hữu duyên cho anh em nào cần nha...! 😊🙏🙏🙏,2025-03-02 03:16:39,2025-06-06 00:07:00,00:00,,1153,184,47,97,"anh3bum, xanhsm, tuitreodienthoaixemay",https://www.tiktok.com/@bum.dai.chien/video/7477045857867615496,7477045934980254465,,,,false
bum.dai.chien,102.7K,7477146429127937288,Trả lời,2025-03-02 09:46:55,2025-06-06 00:07:32,00:00,,487,40,4,39,"anh3bum, xanhsm, kinhnamnu",https://www.tiktok.com/@bum.dai.chien/video/7477146429127937288,7477146462046243600,,,,false
bum.dai.chien,102.7K,7477613707820846356,Hữu duyên chị khách dễ thương quá!🤭😅😅😅,2025-03-03 16:00:12,2025-06-06 00:08:06,00:00,2.5M,48.8K,1126,1028,2368,"anh3bum, xanhsm, bodymist",https://www.tiktok.com/@bum.dai.chien/video/7477613707820846356,7477613759558011649,,,Anh 3 Bum,true
bum.dai.chien,102.7K,7478002693932371218,Chuyện không kể lúc nữa đêm...!,2025-03-04 17:09:40,2025-06-06 00:08:39,01:52,,2580,199,213,239,"anh3bum, xanhsm, xanhcreator, xanhsmexpress, giaocatraitim, kechuyendemkhuya",https://www.tiktok.com/@bum.dai.chien/video/7478002693932371218,7478002968861182737,nhạc nền - Anh 3 Bum,1 videos,Anh 3 Bum,true
bum.dai.chien,102.7K,7480171767684779284,Chuyện không kể lúc nữa đêm...!🙄🥶🥶🥶🙏,2025-03-10 13:26:47,2025-06-06 00:09:09,00:34,,1598,106,94,158,"anh3bum, xanhsm, kechuyenma",https://www.tiktok.com/@bum.dai.chien/video/7480171767684779284,7480171865835752209,,1 videos,Anh 3 Bum,true
bum.dai.chien,102.7K,7480787269184441620,Hữu duyên nha cả nhà mình ơi...!😊🙏🙏🙏,2025-03-12 05:15:14,2025-06-06 00:09:44,00:00,,208,32,5,15,"anh3bum, xanhsm, taytebaochet",https://www.tiktok.com/@bum.dai.chien/video/7480787269184441620,7210843402563225602,,,,false
bum.dai.chien,102.7K,7481314361038966036,Cuộc đời lên voi xuống c.ho nên đừng xem thường bất kỳ ai...!,2025-03-13 15:20:38,2025-06-06 00:10:15,01:08,,2697,142,112,239,"anh3bum, xanhsm, xanhcreator, bactaixanh",https://www.tiktok.com/@bum.dai.chien/video/7481314361038966036,7481314480761817872,,,Anh 3 Bum,true
bum.dai.chien,102.7K,7481937785469832469,Trả lời,2025-03-15 07:39:50,2025-06-06 00:10:46,00:00,,438,56,5,31,"anh3bum, taytebaochet, xuhuong",https://www.tiktok.com/@bum.dai.chien/video/7481937785469832469,7481937911101868817,,,Anh 3 Bum,true
bum.dai.chien,102.7K,7482342614730149121,Kẻ tiểu nhân thì được lòng thiếu nữ... nên quân tử toàn tự xử bằng tay...!🙄🤭🤭🤭,2025-03-16 09:50:47,2025-06-06 00:11:19,00:27,,936,40,11,43,"anh3bum, skill, bongda, xuhuong",https://www.tiktok.com/@bum.dai.chien/video/7482342614730149121,7482342670858259201,nhạc nền - Anh 3 Bum,1 videos,Anh 3 Bum,true
bum.dai.chien,102.7K,7483015042208730389,Khó chịu vô cùng thật sự...!,2025-03-18 05:20:08,2025-06-06 00:11:47,04:09,,26.9K,997,308,742,"anh3bum, taixecongnghe",https://www.tiktok.com/@bum.dai.chien/video/7483015042208730389,7483015382459206417,,,Anh 3 Bum,true
bum.dai.chien,102.7K,7483758013141241109,Trúng mánh anh em ơi...😁🙏🙏🙏,2025-03-20 05:23:15,2025-06-06 00:12:16,00:00,,973,77,8,41,"anh3bum, xanhsm, nuochoa, sexymen",https://www.tiktok.com/@bum.dai.chien/video/7483758013141241109,7483758090366536465,,,Anh 3 Bum,true
bum.dai.chien,102.7K,7484972356083961109,XanhSM xin chào...! Kiếm cơm gặp kiếm chuyện...! 🙄👊🇻🇳🇻🇳🇻🇳,2025-03-23 11:55:31,2025-06-06 00:12:44,00:19,,29.4K,479,412,704,"anh3bum, xanhsm, XanhCreator, thu4ngayxanh, chubodoi",https://www.tiktok.com/@bum.dai.chien/video/7484972356083961109,7484972415982848784,,,Anh 3 Bum,true
bum.dai.chien,102.7K,7485287536659598612,Bình tỉnh người đẹp ơi...! XanhSM xin chào 🤭🤣🤣🤣,2025-03-24 08:18:35,2025-06-06 00:13:14,00:13,,3446,199,291,91,"anh3bum, xanhsm, XanhCreator, thu4ngayxanh",https://www.tiktok.com/@bum.dai.chien/video/7485287536659598612,7485287622877678337,nhạc nền - Anh 3 Bum,4 videos,Anh 3 Bum,true
bum.dai.chien,102.7K,7486504711370198293,Nhạc này quen quen...!😁🤭🤭🤭,2025-03-27 15:01:50,2025-06-06 00:13:42,00:20,576.5K,14.2K,146,398,867,"anh3bum, skill, bongda, chubodoi",https://www.tiktok.com/@bum.dai.chien/video/7486504711370198293,7486504752877505297,,,Anh 3 Bum,true
bum.dai.chien,102.7K,7488177265289743622,Con gái khi say cũng dễ thương nhỉ... trời mưa đi chưa xanh đón... 🤭😆😆😆,2025-04-01 03:12:12,2025-06-06 00:14:10,00:16,378.9K,9609,1320,436,309,"anh3bum, xanhsm, thu4ngayxanh, XanhCreator, thu4ngãya, xuhuong",https://www.tiktok.com/@bum.dai.chien/video/7488177265289743622,7488177279789845303,,,Anh 3 Bum,true
bum.dai.chien,102.7K,7489089822020078903,Phút chốc anh yêu lòng...🤭🙃🙃🙃,2025-04-03 14:13:23,2025-06-06 00:14:40,00:18,289.6K,5687,159,654,185,"anh3bum, skill, bongda",https://www.tiktok.com/@bum.dai.chien/video/7489089822020078903,7489089815431908102,nhạc nền - Anh 3 Bum,7 videos,Anh 3 Bum,true
bum.dai.chien,102.7K,7489092811195731255,Cho anh em nào cần...! 🙃😊😊😊,2025-04-03 14:24:59,2025-06-06 00:15:13,00:00,32.9K,342,38,10,20,"anh3bum, aogiunhiet, bongda",https://www.tiktok.com/@bum.dai.chien/video/7489092811195731255,7489092816837069574,nhạc nền - Anh 3 Bum,1 videos,Anh 3 Bum,true
quelinhxinhxeu,1039,7255285963113467142,lau dai tinh aiii❤️‍🔥❤️‍🔥❤️‍🔥,2023-07-13 12:55:00,2025-06-06 00:15:54,00:17,6064,79,8,1,8,"capcut, fyp, xuhuong, vungtau, muinghinhphong, laudaitinhai",https://www.tiktok.com/@quelinhxinhxeu/video/7255285963113467142,7255286000889596677,,,Quế Linh đâyyy,true
quelinhxinhxeu,1039,7259792079197424904,U ok,2023-07-25 16:21:02,2025-06-06 00:16:25,00:09,2601,36,6,Share,0,"fypシ゚viral, foryou",https://www.tiktok.com/@quelinhxinhxeu/video/7259792079197424904,7210511033655757574,,,,false
quelinhxinhxeu,1039,7268113028418194693,🤡🤡,2023-08-17 02:30:34,2025-06-06 00:16:53,00:15,4347,58,13,Share,0,fyp,https://www.tiktok.com/@quelinhxinhxeu/video/7268113028418194693,7235863194122685190,,,,false
quelinhxinhxeu,1039,7303586481510157570,Góc trời của nàng💋💋💋,2023-11-20 16:45:41,2025-06-06 00:17:19,,2299,27,1,1,1,"goctroicuanang, fypシ, foryou, xuhuong, viral, fypシ゚viral, đalat",https://www.tiktok.com/@quelinhxinhxeu/photo/7303586481510157570,6907806926911604738,,,,false
quelinhxinhxeu,1039,7315071315369544961,Chắc gì ta đã có đủ sáu mươi năm cuộc đời..🍃,2023-12-21 15:32:42,2025-06-06 00:17:48,,5166,61,2,1,4,"fypシ, đen",https://www.tiktok.com/@quelinhxinhxeu/photo/7315071315369544961,7311734567495305985,Ta cứ đi cùng nhau,10.9K videos,Cộng Đồng Đồng Âm,false
quelinhxinhxeu,1039,7359116446296722704,,2024-04-18 08:10:18,2025-06-06 00:18:13,00:11,3188,67,3,2,3,"fypシ, viral",https://www.tiktok.com/@quelinhxinhxeu/video/7359116446296722704,7272643848789150465,nhạc nền - Nghĩa tũn,54.4K videos,𝙉𝙂𝙃𝙄̃𝘼 𝙏𝙐𝙉 🐼,false
quelinhxinhxeu,1039,7493177696315297042,Cú twist đến từ em 🐉 tháng 12🥳🥳,2025-04-14 14:36:26,2025-06-06 00:18:38,00:19,4096,39,3,3,0,"CapCut, fypシ, viral, embedangyeu, mebimsua, embe, xuhuong, embedethuong",https://www.tiktok.com/@quelinhxinhxeu/video/7493177696315297042,7401805069593021201,,,user81555491396,false
quelinhxinhxeu,1039,7493361700125674770,,2025-04-15 02:30:27,2025-06-06 00:19:04,00:10,4208,52,16,3,1,"chickenbanana, banana, fypシ, viral",https://www.tiktok.com/@quelinhxinhxeu/video/7493361700125674770,7465696476092042006,Chicken Banana,1.9M videos,CrazyMusicChannel,false
quelinhxinhxeu,1039,7497860255087463687,chiếc embe thích ngủ nghiêng🤤🥰🥰,2025-04-27 05:27:09,2025-06-06 00:19:30,00:22,1189,21,6,1,0,"capcut, embe, tunhienchungta, tunhien",https://www.tiktok.com/@quelinhxinhxeu/video/7497860255087463687,7496877457530718977,,12.4K videos,Ng Hthuog,false
quelinhxinhxeu,1039,7499311651267661064,khối bú bình nghe lệnh😍😍,2025-05-01 03:19:18,2025-06-06 00:19:55,00:19,1186,29,5,Share,0,"capcut, giaiphongmiennam3041975, embedangyeu, khốibúbình, embedethuong, duyệtbinh",https://www.tiktok.com/@quelinhxinhxeu/video/7499311651267661064,7360927197320334097,,,Mèo🐣,false
quelinhxinhxeu,1039,7499696084017483015,🏠🏠Nhà là nơi ấm áp ngọt ngào mà đôi khi ta hay quên🥰,2025-05-02 04:11:06,2025-06-06 00:20:21,03:11,1532,26,8,7,0,"nhàlanoibinhyennhat, nhalanoibinhyennhat, nhà, vir, viral, xuhuong",https://www.tiktok.com/@quelinhxinhxeu/video/7499696084017483015,7499696198706645777,nhạc nền - QUẾ LINH,1 videos,Quế Linh đâyyy,true
quelinhxinhxeu,1039,7507536773539466504,em là,2025-05-23 07:16:59,2025-06-06 00:20:49,00:08,596,27,2,2,0,"capcut, emberong🐉, embe, embedangyeu",https://www.tiktok.com/@quelinhxinhxeu/video/7507536773539466504,7446257337502845712,,,𝓡𝓪𝓷𝓲𝓮🕊️,false
hongtotheheart,723.2K,7492018822338170120,Có khứa nào đoán ra được quy luật gì không nhỉ?? 🙄🙄,2025-04-11 11:39:24,2025-06-06 00:21:33,00:55,987.8K,5701,1281,66,231,"phongvanduongpho, hongtotheheart, beatnetwork, genz, giaitri, game",https://www.tiktok.com/@hongtotheheart/video/7492018822338170120,7492019082117548817,,,HÓNG TO THE HEART,true
hongtotheheart,723.2K,7491215320544464146,"Trai đẹp khó tánh đến mấy cũng có lúc phải ""quay xe"" thôiii 😎😎",2025-04-09 07:41:24,2025-06-06 00:22:08,01:57,76.8K,537,4,6,37,"nuochoathoithuong, nganmuihangngay, hoptaccungunilever, axe, axefinefragrance, hongtotheheart, phongvanduongpho, beatnetwork",https://www.tiktok.com/@hongtotheheart/video/7491215320544464146,7491215404354915089,,,HÓNG TO THE HEART,true
hongtotheheart,723.2K,7490917551006829832,"Ông nào cũng ""mét 8 mét 8"" là sao nhỉiiii? 😊😊",2025-04-08 12:25:54,2025-06-06 00:22:45,01:22,1M,39.3K,254,790,2009,"phongvanduongpho, hongtotheheart, beatnetwork, genz, giaitri, trending",https://www.tiktok.com/@hongtotheheart/video/7490917551006829832,7490917672721337104,,,HÓNG TO THE HEART,true
hongtotheheart,723.2K,7489787275333602565,Game là dễ nhỉ mấy khứa 😎😎,2025-04-05 11:19:52,2025-06-06 00:23:14,01:10,16.6K,142,12,8,7,"phongvanduongpho, hongtotheheart, beatnetwork, genz, giaitri, hack",https://www.tiktok.com/@hongtotheheart/video/7489787275333602565,7489787323425852166,nhạc nền,1 videos,HÓNG TO THE HEART,true
hongtotheheart,723.2K,7489063203477982519,Cái nào cũng thấy sai mà cũng thấy đúng là sao ta 😑😑,2025-04-03 12:30:06,2025-06-06 00:23:41,01:12,1.2M,12.5K,562,190,239,"phongvanduongpho, hongtotheheart, beatnetwork, genz, giaitri, hack",https://www.tiktok.com/@hongtotheheart/video/7489063203477982519,7489063214534839045,,,HÓNG TO THE HEART,true
hongtotheheart,723.2K,7487940131710700855,Chời ơi mâu mừn bay tứ tung lun 🙄💓💓,2025-03-31 11:52:00,2025-06-06 00:24:07,01:00,2M,29.4K,222,271,948,"phongvanduongpho, hongtotheheart, beatnetwork, genz, giaitri, hack",https://www.tiktok.com/@hongtotheheart/video/7487940131710700855,7487940155626572550,,,HÓNG TO THE HEART,true
hongtotheheart,723.2K,7486826403527167287,Có ai biết tại sao không ạ? 🤔🤔,2025-03-28 11:50:10,2025-06-06 00:24:31,01:06,176.2K,1384,375,19,65,"phongvanduongpho, hongtotheheart, beatnetwork, genz, giaitri, hack",https://www.tiktok.com/@hongtotheheart/video/7486826403527167287,7486826444325964550,,,,false
hongtotheheart,723.2K,7486067964442152200,Chứ tôi là thấy hơi sao sao rồi á 😱😱,2025-03-26 10:47:02,2025-06-06 00:24:56,00:50,11K,193,7,12,9,"phongvanduongpho, hongtotheheart, beatnetwork, genz, trending, giaitri",https://www.tiktok.com/@hongtotheheart/video/7486067964442152200,7486068017873324816,,,HÓNG TO THE HEART,true
hongtotheheart,723.2K,7484605831770688775,Hoá ra bình thường mấy ông bạo zậy ư 😃😃,2025-03-22 12:13:13,2025-06-06 00:25:23,01:11,933K,48.8K,742,2981,1992,"phongvanduongpho, hongtotheheart, beatnetwork, genz, giaitri, trending",https://www.tiktok.com/@hongtotheheart/video/7484605831770688775,7484605875442305793,,,HÓNG TO THE HEART,true
hongtotheheart,723.2K,7483872365789728007,Đi theo nhau mà không có tình ý ư tôi không tin 😌😌,2025-03-20 12:46:59,2025-06-06 00:25:58,01:58,93.7K,2605,28,49,145,"phongvanduongpho, hongtotheheart, beatnetwork, genz, giaitri, ghepdoi",https://www.tiktok.com/@hongtotheheart/video/7483872365789728007,7483872420785408769,,,HÓNG TO THE HEART,true
hongtotheheart,723.2K,7482408323543780616,Cứ cong cong thẳng thẳng hoa hết cả mắt 😵‍💫😵‍💫,2025-03-16 14:05:46,2025-06-06 00:26:32,01:19,15K,190,17,2,12,"phongvanduongpho, hongtotheheart, beatnetwork, genz, game, hack",https://www.tiktok.com/@hongtotheheart/video/7482408323543780616,7482408495959902992,,,HÓNG TO THE HEART,true
hongtotheheart,723.2K,7481517311749377298,"Hoá ra lí do để mấy khứa hay ""iu nhau lắm c.ắ.n nhau đau"" là như này à? 🙄🙄",2025-03-14 04:28:11,2025-06-06 00:27:03,01:56,109.7K,920,33,27,72,anhkhongdau,https://www.tiktok.com/@hongtotheheart/video/7481517311749377298,7481517579220159248,,,,false
hongtotheheart,723.2K,7481262957985385735,Ai cũng tưởng dễ mà chưa ai làm được 🤭🤭,2025-03-13 12:01:09,2025-06-06 00:27:35,01:23,4.4M,71.9K,551,707,2043,"phongvanduongpho, hongtotheheart, beatnetwork, genz, game, hack",https://www.tiktok.com/@hongtotheheart/video/7481262957985385735,7481263065892883217,,,HÓNG TO THE HEART,true
