user_name,user_nfollower,vid_id,vid_caption,vid_postTime,vid_scrapeTime,vid_duration,vid_nview,vid_nlike,vid_ncomment,vid_nshare,vid_nsave,vid_hashtags,vid_url,music_id,music_title,music_nused,music_authorName,music_originality
monoandstories,173.5K,7465954356815318273,Mùng 3 với x2 chiếc visual !!! 😎✨,2025-01-31 05:55:58,2025-06-05 11:57:54,00:25,,1963,10,14,90,"mono, monoviethoang, monoandstories, fcmono, sontungmtp, mtp",https://www.tiktok.com/@monoandstories/video/7465954356815318273,7454410835289557777,nhạc nền - 𝐂𝐚̂̉𝐦 𝐋𝐲,10.6K videos,𝐂𝐚̂̉𝐦 𝐋𝐲,false
monoandstories,173.5K,7467494949907483905,1 chiếc clip đã lâu. Em bé bỏ mẹ chạy theo chú Mono !!! 🤣,2025-02-04 09:34:15,2025-06-05 11:58:10,00:15,,8269,26,140,280,"mono, monoviethoang, monoandstories, fcmono",https://www.tiktok.com/@monoandstories/video/7467494949907483905,7467495147404593936,nhạc nền - MONO and Stories,1 videos,MONO and Stories,true
monoandstories,173.5K,7467895486716873985,"Thì ra là video, xém hiểu nhầm là clip rồi …😞🥲",2025-02-05 11:28:32,2025-06-05 11:58:27,00:08,,16.4K,78,1237,489,"mono, monoviethoang, monoandstories, fcmono",https://www.tiktok.com/@monoandstories/video/7467895486716873985,7467895604597869328,nhạc nền - MONO and Stories,5 videos,MONO and Stories,true
monoandstories,173.5K,7469250679580806416,Top 1 trend !!! 😈😎,2025-02-09 03:07:23,2025-06-05 11:58:46,00:17,,749,6,40,61,"mono, monoviethoang, monoandstories, fcmono",https://www.tiktok.com/@monoandstories/video/7469250679580806416,7464457118347774737,nhạc nền - kzu,12.4K videos,kzu,false
monoandstories,173.5K,7471860327748095248,Cậu Hoàng đưa mãi mới chịu cầm cơ đấy !!! 🧧☺️,2025-02-16 03:54:09,2025-06-05 11:59:01,00:54,,473,10,14,25,"mono, monoviethoang, monoandstories, fcmono",https://www.tiktok.com/@monoandstories/video/7471860327748095248,7471860510737402640,nhạc nền - MONO and Stories,1 videos,MONO and Stories,true
monoandstories,173.5K,7472750525306522896,Mono diện outfit trắng cực bảnh tới tham dự họp báo phim tối nay !!!,2025-02-18 13:28:34,2025-06-05 11:59:20,00:14,,11.3K,69,333,646,"mono, monoviethoang, monoandstories, fcmono",https://www.tiktok.com/@monoandstories/video/7472750525306522896,7472750644617546497,nhạc nền - MONO and Stories,3 videos,MONO and Stories,true
monoandstories,173.5K,7472754112325553425,Mono tình tứ chụp hình cùng Huỳnh Lập tại thảm đỏ họp báo ra mắt phim Nhà Gia Tiên tối nay !!!,2025-02-18 13:42:29,2025-06-05 11:59:34,00:16,,1069,10,12,49,"mono, monoviethoang, monoandstories, fcmono, huynhlap",https://www.tiktok.com/@monoandstories/video/7472754112325553425,7472754335349312272,nhạc nền - MONO and Stories,2 videos,MONO and Stories,true
monoandstories,173.5K,7472774736758443280,Bạn fan vừa hoàn thành xong 2 năm nghĩa vụ quân sự liền đem món quà đặc biệt gửi tặng cho đồng chí Mono !!! 🫡✨,2025-02-18 15:02:31,2025-06-05 11:59:48,00:40,,2289,11,29,84,"mono, monoviethoang, monoandstories, fcmono",https://www.tiktok.com/@monoandstories/video/7472774736758443280,7472774895434238721,nhạc nền - MONO and Stories,1 videos,MONO and Stories,true
monoandstories,173.5K,7472975259684080913,Chiếc em bé xịt keo khi được chú Mono bế chụp hình !!! ☺️🫠,2025-02-19 04:00:39,2025-06-05 12:00:02,00:40,,573,18,4,20,"mono, monoviethoang, monoandstories, fcmono",https://www.tiktok.com/@monoandstories/video/7472975259684080913,7472975399207570193,nhạc nền - MONO and Stories,1 videos,MONO and Stories,true
monoandstories,173.5K,7473085060569255169,Gặp anh chị là tranh thủ xúm lại chụp tấm hình liền !!! 🫶🥰,2025-02-19 11:06:44,2025-06-05 12:00:17,00:18,,585,9,Share,16,"mono, monoviethoang, monoandstories, fcmono",https://www.tiktok.com/@monoandstories/video/7473085060569255169,7473085181793012481,nhạc nền - MONO and Stories,2 videos,MONO and Stories,true
monoandstories,173.5K,7475938389515111687,Không chịu nghiêm túc gì cả =))),2025-02-27 03:39:07,2025-06-05 12:00:34,00:17,,11.3K,342,1105,369,"mono, monoviethoang, monoandstories, fcmono",https://www.tiktok.com/@monoandstories/video/7475938389515111687,7475938435212380945,nhạc nền - MONO and Stories,136 videos,MONO and Stories,true
monoandstories,173.5K,7479068839943392519,Hoàng Tử xuất hiện tại event tối nay !!! ✨✨,2025-03-07 14:06:51,2025-06-05 12:00:50,00:13,,4248,59,79,149,"mono, monoviethoang, monoandstories, fcmono, dior",https://www.tiktok.com/@monoandstories/video/7479068839943392519,7476970197267335953,nhạc nền - _hoaithu1508,2271 videos,_hoaithu1508,false
monoandstories,173.5K,7479319580905721089,Xịt keo luôn =)))),2025-03-08 06:19:52,2025-06-05 12:01:05,00:28,,34.6K,196,2768,1246,"mono, monoviethoang, monoandstories, fcmono",https://www.tiktok.com/@monoandstories/video/7479319580905721089,7479319994275269392,nhạc nền - MONO and Stories,1 videos,MONO and Stories,true
monoandstories,173.5K,7481944988121713937,Mono rehearsal cho màn trình diễn tối nay tại Hà Nội !!! 🕺,2025-03-15 08:07:47,2025-06-05 12:01:18,00:24,,997,38,15,33,"mono, monoviethoang, monoandstories, ditimtinhyeu",https://www.tiktok.com/@monoandstories/video/7481944988121713937,7481945238236449552,nhạc nền - MONO and Stories,3 videos,MONO and Stories,true
monoandstories,173.5K,7481978249048788241,Waiting For You version gốc vẫn tuyệt zời nhất !!!🥺✨,2025-03-15 10:16:51,2025-06-05 12:01:36,00:40,,743,14,18,29,"mono, monoviethoang, monoandstories, waitingforyou",https://www.tiktok.com/@monoandstories/video/7481978249048788241,7481978465396280081,nhạc nền - MONO and Stories,1 videos,MONO and Stories,true
monoandstories,173.5K,7482069695680613649,Mono nhảy cực cháy tại sân vận động quốc gia Mỹ Đình tối nayy !!! 🕺🔥,2025-03-15 16:11:43,2025-06-05 12:01:50,00:38,,2328,24,29,110,"mono, monoviethoang, monoandstories, ditimtinhyeu",https://www.tiktok.com/@monoandstories/video/7482069695680613649,7482069880842373904,nhạc nền - MONO and Stories,2 videos,MONO and Stories,true
monoandstories,173.5K,7482077083544390929,Mono mang hit ‘Waiting For You’ khuấy động sân vận động quốc gia Mỹ Đình tối nay !!! ✨,2025-03-15 16:40:23,2025-06-05 12:02:05,00:44,,190,3,Share,6,"mono, monoviethoang, monoandstories, waitingforyou",https://www.tiktok.com/@monoandstories/video/7482077083544390929,7482077600651676432,nhạc nền - MONO and Stories,1 videos,MONO and Stories,true
monoandstories,173.5K,7482226749342895361,Hit ‘Waiting For You’ được Mono trình diễn tại sân vận động quốc gia Mỹ Đình tối qua !!! 🔥,2025-03-16 02:21:10,2025-06-05 12:02:18,01:37,,338,7,3,15,"mono, monoviethoang, monoandstories, waitingforyou",https://www.tiktok.com/@monoandstories/video/7482226749342895361,7482226954582657809,nhạc nền - MONO and Stories,1 videos,MONO and Stories,true
monoandstories,173.5K,7482331337701985553,Mono ‘Chăm Hoa’ tại sân vận động quốc gia Mỹ Đình tối qua !!!🌷💐,2025-03-16 09:07:01,2025-06-05 12:02:35,00:38,,6953,66,65,282,"mono, monoviethoang, monoandstories, chamhoa",https://www.tiktok.com/@monoandstories/video/7482331337701985553,7482331520158468881,nhạc nền - MONO and Stories,7 videos,MONO and Stories,true
monoandstories,173.5K,7483409574297455873,Cùng chờ đón bộ ảnh với sự kết hợp đặc biệt giữa Mono & Cartier nhá !!! ✨🫶,2025-03-19 06:51:07,2025-06-05 12:02:49,00:27,,204,6,3,16,"mono, cartier, cartiervietnam, happerbazzar, happerbazzarvietnam, monoandstories, monoviethoang",https://www.tiktok.com/@monoandstories/video/7483409574297455873,7483409684884425473,nhạc nền - MONO and Stories,1 videos,MONO and Stories,true
almondbabybigboy,592.4K,7432975346930175239,มาช้าแต่มานะ,2024-11-03 09:00:34,2025-06-05 12:03:34,00:15,2.4M,471.4K,2462,12.4K,37.5K,,https://www.tiktok.com/@almondbabybigboy/video/7432975346930175239,7432043471873624833,เสียงต้นฉบับ - ป๋องแป๋ง🥫,2473 videos,ป๋องแป๋ง🥫,false
almondbabybigboy,592.4K,7414377835948805383,,2024-09-14 06:12:43,2025-06-05 12:03:48,00:15,4.5M,760.6K,893,28.2K,44.5K,,https://www.tiktok.com/@almondbabybigboy/video/7414377835948805383,7390353976145054480,เสียงต้นฉบับ - 3800 TH,7968 videos,3800 TH,false
almondbabybigboy,592.4K,7507236854790425874,เจิดจรัส,2025-05-22 11:53:08,2025-06-05 12:04:02,00:15,450.6K,144.4K,1056,5757,9792,"ด้อมภภ, pspw, progresspassawish, almondbabybigboy",https://www.tiktok.com/@almondbabybigboy/video/7507236854790425874,7499756868518053904,เจิดจรัส (preview),6790 videos,YOUNG ILL,false
almondbabybigboy,592.4K,7505374896931884296,Ruby,2025-05-17 11:27:48,2025-06-05 12:04:18,00:09,678.7K,218K,1182,6151,15K,"pspw, ด้อมภภ",https://www.tiktok.com/@almondbabybigboy/video/7505374896931884296,7494182579361663760,오리지널 사운드 - Jun S,76.1K videos,,false
almondbabybigboy,592.4K,7505002755828747528,ลดแรงแซงทุกมื้อ,2025-05-16 11:23:42,2025-06-05 12:04:33,00:20,153.3K,33K,634,917,2669,"grabfoodลดหั่นครึ่งส่งไวทุกมื้อ, grabfoodลดแรงทุกวันอิ่มคุ้มทุกเวลา",https://www.tiktok.com/@almondbabybigboy/video/7505002755828747528,7505002771239045905,เสียงต้นฉบับ - แอลม่อนไม่ใช่อัลม่อน,11 videos,แอลม่อนไม่ใช่อัลม่อน,true
almondbabybigboy,592.4K,7501950270272703751,,2025-05-08 05:58:30,2025-06-05 12:04:49,00:15,790.1K,235.5K,1758,8377,18.2K,,https://www.tiktok.com/@almondbabybigboy/video/7501950270272703751,7320625676359961350,original sound - allen,94.7K videos,allen,false
almondbabybigboy,592.4K,7501690040737647879,ไปเก็บความน่ารักแบบ 4K กับ Galaxy A56 5G กัน,2025-05-07 13:08:40,2025-06-05 12:05:03,01:10,249.7K,70.5K,865,1726,5324,"galaxya56, withgalaxy, teamgalaxy",https://www.tiktok.com/@almondbabybigboy/video/7501690040737647879,7501690080181586704,เสียงต้นฉบับ - แอลม่อนไม่ใช่อัลม่อน,2 videos,แอลม่อนไม่ใช่อัลม่อน,true
almondbabybigboy,592.4K,7487859866975882501,วันว่างๆกับMCM,2025-03-31 06:40:32,2025-06-05 12:05:15,00:08,392.7K,54.8K,697,1272,4193,mcm,https://www.tiktok.com/@almondbabybigboy/video/7487859866975882501,7487859870339762950,เสียงต้นฉบับ - แอลม่อนไม่ใช่อัลม่อน,2 videos,แอลม่อนไม่ใช่อัลม่อน,true
almondbabybigboy,592.4K,7484207432160316680,"""Hello samsung""",2025-03-21 10:27:13,2025-06-05 12:05:31,00:20,536.6K,135.9K,594,1765,8063,"galaxys25ultra, teamgalaxy",https://www.tiktok.com/@almondbabybigboy/video/7484207432160316680,7484207457196083984,เสียงต้นฉบับ - แอลม่อนไม่ใช่อัลม่อน,9 videos,แอลม่อนไม่ใช่อัลม่อน,true
almondbabybigboy,592.4K,7483077655663791368,คลิปนี้ผมพูดโปรเกรสกี่คำ,2025-03-18 09:23:07,2025-06-05 12:05:49,01:13,392.1K,76K,591,1308,6094,"galaxya56, withgalaxy, teamgalaxy",https://www.tiktok.com/@almondbabybigboy/video/7483077655663791368,7483077687318448912,เสียงต้นฉบับ - แอลม่อนไม่ใช่อัลม่อน,3 videos,แอลม่อนไม่ใช่อัลม่อน,true
almondbabybigboy,592.4K,7479701362461265159,ตีหนึ่งก็ยังสั่งไลน์แมน,2025-03-09 07:01:22,2025-06-05 12:06:08,00:15,463K,109.4K,730,3541,9616,linemanfoodiesgymxlovesickgang,https://www.tiktok.com/@almondbabybigboy/video/7479701362461265159,7477928033362675713,ตีหนึ่งที่คูเมือง,795.6K videos,Illslick Thelegendary,false
almondbabybigboy,592.4K,7476682810653199624,เธออยากเป็นดีเจ,2025-03-01 03:47:51,2025-06-05 12:06:29,00:15,2.4M,584.7K,2375,25K,37.3K,,https://www.tiktok.com/@almondbabybigboy/video/7476682810653199624,7463336987346389009,นครดารา (preview),52.8K videos,YOUNG ILL,false
almondbabybigboy,592.4K,7473462400046337298,ไลน์แมนแสกนได้,2025-02-20 11:31:00,2025-06-05 12:06:44,00:15,745.2K,153.8K,1057,4262,12.7K,"linemanxalmondprogress, almondbabybigboy, progresspassawish, ด้อมภภ, pspw",https://www.tiktok.com/@almondbabybigboy/video/7473462400046337298,7240703848396884741,เสียงต้นฉบับ - 🐿️,43.3K videos,🐿️,false
almondbabybigboy,592.4K,7471926478603652359,สองตัวชัวร์จริง,2025-02-16 08:10:51,2025-06-05 12:07:02,00:15,555.1K,131.7K,1002,4501,11.6K,,https://www.tiktok.com/@almondbabybigboy/video/7471926478603652359,7410410401228262160,เสียงต้นฉบับ - KORNRMX,241.9K videos,KORNRMX,false
almondbabybigboy,592.4K,7469051148125670674,แค่อยากบอกว่าน่ารักคือมาเป็นตาน่าฮัก,2025-02-08 14:13:06,2025-06-05 12:07:17,00:15,808.3K,216.1K,1548,10.5K,17.4K,,https://www.tiktok.com/@almondbabybigboy/video/7469051148125670674,6984207476656835355,เสียงต้นฉบับ - 🧸🧋❤️,6909 videos,𝕸𝖚𝖘𝖎𝖈.,false
quycaynhat,258.3K,7444918457595907348,Thả mấy em cá cờ,2024-12-05 13:25:56,2025-06-05 12:10:56,01:21,23.5M,632.5K,3314,10.6K,21.2K,"theanh28, quycaynhat, hatkichre, loduongchat, thuoclua",https://www.tiktok.com/@quycaynhat/video/7444918457595907348,6775818060453382146,,,,false
quycaynhat,258.3K,7325802323895241985,Cách làm tre MiNi bonsai,2024-01-19 13:34:30,2025-06-05 12:11:15,01:42,8.6M,95.1K,803,824,4646,"theanh28, quycaynhat, nhahatkichhanoi",https://www.tiktok.com/@quycaynhat/video/7325802323895241985,7296136277207730178,พี่ชอบหนูที่สุดเลย (I Like You The Most) (Speed Up),27.8M videos,พลเช้ดที่ไม่ค่อยปล่อยเพลง 💐|วาลินกินกับอะไรก็อร่อย,false
quycaynhat,258.3K,7175110683518930202,Thay chậu Táo cho Ông Anh thân hình tạ mốt,2022-12-09 11:33:58,2025-06-05 12:11:40,00:57,9.4M,247.8K,4226,593,4219,"bonsai, bonsaimini, bonsainhatban, quycaynhat, caycanh, caycanhbonsai, bonsaideban, phonglado",https://www.tiktok.com/@quycaynhat/video/7175110683518930202,7175110716410694427,nhạc nền - Quý Cây Nhật,1 videos,Quý Cây Nhật,true
quycaynhat,258.3K,7508746777676369160,Có AE nào chơi duối mini không?,2025-05-26 13:32:25,2025-06-05 12:12:01,02:28,80.1K,1772,40,28,99,"theanh28, quycaynhat, hatkichre, loduongchat, thuoclua",https://www.tiktok.com/@quycaynhat/video/7508746777676369160,7005871610842318850,i want it i got it,3M videos,,false
quycaynhat,258.3K,7508359044978052359,Theo AE thì nó có ra được quả không?,2025-05-25 12:27:49,2025-06-05 12:12:19,01:09,109.4K,1490,22,9,50,"theanh28, quycaynhat, hatkichre, loduongchat, thuoclua",https://www.tiktok.com/@quycaynhat/video/7508359044978052359,7065705246124247041,Speed Dial (Demo),612.6K videos,Kayla Grace,false
quycaynhat,258.3K,7506889269550796039,Trồng trên viên đá này có ổn không AE nhỉ?,2025-05-21 13:24:20,2025-06-05 12:12:40,02:39,111.5K,1194,29,11,39,"theanh28, quycaynhat, hatkichre, loduongchat, thuoclua",https://www.tiktok.com/@quycaynhat/video/7506889269550796039,7296136277207730178,พี่ชอบหนูที่สุดเลย (I Like You The Most) (Speed Up),27.8M videos,พลเช้ดที่ไม่ค่อยปล่อยเพลง 💐|วาลินกินกับอะไรก็อร่อย,false
quycaynhat,258.3K,7506153368000220424,Có ai thích làm Hồ Koi tự nhiên như này không?,2025-05-19 13:48:40,2025-06-05 12:12:59,02:49,608.4K,9443,224,165,347,"theanh28, quycaynhat, hatkichre, loduongchat, thuoclua",https://www.tiktok.com/@quycaynhat/video/7506153368000220424,7005871610842318850,i want it i got it,3M videos,,false
quycaynhat,258.3K,7505407007667621138,"Có ai thích Hồ Koi kiểu tự nhiên như này không, cần thì ib em nha",2025-05-17 13:32:24,2025-06-05 12:13:15,02:03,1.6M,30.5K,435,401,1052,"theanh28, quycaynhat, hatkichre, loduongchat, thuoclua",https://www.tiktok.com/@quycaynhat/video/7505407007667621138,6968950803416254465,CAP,2.5M videos,BigVibesBurrell,false
quycaynhat,258.3K,7504309673168817416,Có ai thích hồ Koi theo kiểu tự nhiên không ak,2025-05-14 14:34:11,2025-06-05 12:13:31,01:47,652.1K,12K,275,170,466,"theanh28, quycaynhat, hatkichre, loduongchat, thuoclua",https://www.tiktok.com/@quycaynhat/video/7504309673168817416,7296136277207730178,พี่ชอบหนูที่สุดเลย (I Like You The Most) (Speed Up),27.8M videos,พลเช้ดที่ไม่ค่อยปล่อยเพลง 💐|วาลินกินกับอะไรก็อร่อย,false
quycaynhat,258.3K,7503574551251455239,Chơi Koi hệ ít tiền hihi,2025-05-12 15:01:32,2025-06-05 12:13:50,02:14,1.2M,14.6K,333,200,665,"theanh28, quycaynhat, hatkichre, loduongchat, thuoclua",https://www.tiktok.com/@quycaynhat/video/7503574551251455239,7296136277207730178,พี่ชอบหนูที่สุดเลย (I Like You The Most) (Speed Up),27.8M videos,พลเช้ดที่ไม่ค่อยปล่อยเพลง 💐|วาลินกินกับอะไรก็อร่อย,false
quycaynhat,258.3K,7502066667455925511,Mời AE đến triển lãm hoa cây cảnh VNUA học viện Nông Nghiệp 2025 nhé,2025-05-08 13:30:10,2025-06-05 12:14:07,02:09,69.4K,530,29,5,21,"theanh28, quycaynhat, hatkichre, loduongchat, thuoclua",https://www.tiktok.com/@quycaynhat/video/7502066667455925511,7296136277207730178,พี่ชอบหนูที่สุดเลย (I Like You The Most) (Speed Up),27.8M videos,พลเช้ดที่ไม่ค่อยปล่อยเพลง 💐|วาลินกินกับอะไรก็อร่อย,false
quycaynhat,258.3K,7501692477527559442,5l AE nào chơi không?,2025-05-07 13:18:08,2025-06-05 12:14:47,02:51,68.5K,999,49,10,34,"theanh28, quycaynhat, hatkichre, loduongchat, thuoclua",https://www.tiktok.com/@quycaynhat/video/7501692477527559442,7005871610842318850,i want it i got it,3M videos,,false
quycaynhat,258.3K,7501333019664354568,Theo AE thì cắt đi đẹp hay để lại đẹp hơn?,2025-05-06 14:03:15,2025-06-05 12:15:10,02:40,126.3K,1442,119,26,61,"theanh28, quycaynhat, hatkichre, loduongchat, thuoclua",https://www.tiktok.com/@quycaynhat/video/7501333019664354568,7005871610842318850,i want it i got it,3M videos,,false
quycaynhat,258.3K,7500585548403330311,Theo AE cắt cây con đi đẹp hơn hay để đẹp hơn?,2025-05-04 13:42:41,2025-06-05 12:15:28,01:36,473.4K,4947,321,51,152,"theanh28, quycaynhat, hatkichre, loduongchat, thuoclua",https://www.tiktok.com/@quycaynhat/video/7500585548403330311,7065705246124247041,Speed Dial (Demo),612.6K videos,Kayla Grace,false
quycaynhat,258.3K,7500208231768182034,Nuôi cây không cần chậu,2025-05-03 13:18:30,2025-06-05 12:15:50,02:57,702.2K,7371,100,109,316,"theanh28, quycaynhat, hatkichre, loduongchat, thuoclua",https://www.tiktok.com/@quycaynhat/video/7500208231768182034,7296136277207730178,พี่ชอบหนูที่สุดเลย (I Like You The Most) (Speed Up),27.8M videos,พลเช้ดที่ไม่ค่อยปล่อยเพลง 💐|วาลินกินกับอะไรก็อร่อย,false
quycaynhat,258.3K,7499841136576564488,AE có ai muốn làm đế to không?,2025-05-02 13:33:59,2025-06-05 12:16:08,02:04,140.9K,2068,73,30,68,"theanh28, quycaynhat, hatkichre, loduongchat, thuoclua",https://www.tiktok.com/@quycaynhat/video/7499841136576564488,7005871610842318850,i want it i got it,3M videos,,false
quycaynhat,258.3K,7499712352149982471,AE nào cần ib e Quý nha,2025-05-02 05:14:14,2025-06-05 12:16:25,00:59,52.9K,554,35,21,25,"theanh28, quycaynhat, hatkichre, loduongchat, thuoclua",https://www.tiktok.com/@quycaynhat/video/7499712352149982471,7005871610842318850,i want it i got it,3M videos,,false
quycaynhat,258.3K,7498339039225974023,Cắt tỉa cây Phong,2025-04-28 12:25:04,2025-06-05 12:16:38,01:30,67.4K,846,19,12,35,"theanh28, quycaynhat, hatkichre, loduongchat, thuoclua",https://www.tiktok.com/@quycaynhat/video/7498339039225974023,7065705246124247041,Speed Dial (Demo),612.6K videos,Kayla Grace,false
quycaynhat,258.3K,7497228145251323143,"Cách chăm sóc cây, combo có trong giỏ hàng AE nhé",2025-04-25 12:34:14,2025-06-05 12:16:55,02:15,144.9K,636,16,15,36,"theanh28, quycaynhat, hatkichre, loduongchat, thuoclua",https://www.tiktok.com/@quycaynhat/video/7497228145251323143,7005871610842318850,i want it i got it,3M videos,,false
quycaynhat,258.3K,7496496061414935816,AE nào cần ib e nha,2025-04-23 13:13:23,2025-06-05 12:17:11,03:46,56.6K,571,24,14,19,"theanh28, quycaynhat, hatkichre, loduongchat, thuoclua",https://www.tiktok.com/@quycaynhat/video/7496496061414935816,7005871610842318850,i want it i got it,3M videos,,false
thaoni_0111,6954,7411780544649776400,Học sinh trường em 😍,2024-09-07 06:13:54,2025-06-05 12:17:37,00:41,1.5M,51.8K,1386,2202,2489,"mộtvòngviệtnam, khaigiang, thcstanphuockhanh",https://www.tiktok.com/@thaoni_0111/video/7411780544649776400,7411780649989704464,nhạc nền - Thảo Ni,3 videos,Thảo Ni,true
thaoni_0111,6954,7508917053215018257,Hè rồi chiến thôi 😚,2025-05-27 00:33:10,2025-06-05 12:17:50,00:34,3941,52,5,3,0,,https://www.tiktok.com/@thaoni_0111/video/7508917053215018257,7508917409131121409,nhạc nền - Thảo Ni,1 videos,Thảo Ni,true
thaoni_0111,6954,7508716302203194640,Thanh xuân chỉ rực rỡ 1 lần rồi thôi 🥰,2025-05-26 11:34:09,2025-06-05 12:18:06,00:18,4204,59,2,1,4,"vitaminsea🌊, vinhhy, hangrai",https://www.tiktok.com/@thaoni_0111/video/7508716302203194640,7388370476143692561,original sound - Nguyen Thị Thúy Nga,4558 videos,Ở đây chỉ có tuiiii,false
thaoni_0111,6954,7493894417858776336,Cô không tin mình dữ nhưng đây là cô khi lên lớp 🫢,2025-04-16 12:57:40,2025-06-05 12:18:20,00:10,12.2K,81,14,13,1,"viralvideo, tik_tok",https://www.tiktok.com/@thaoni_0111/video/7493894417858776336,7490174324528679686,nhạc nền - 𝑯𝒂 𝑻𝒖𝒚𝒆𝒕 𝑺𝒖𝒐𝒏𝒈,197.1K videos,𝑯𝒂 𝑻𝒖𝒚𝒆𝒕 𝑺𝒖𝒐𝒏𝒈,false
thaoni_0111,6954,7484487973430430993,CHƯỚNG 🙂,2025-03-22 04:35:52,2025-06-05 12:18:34,00:26,9960,189,27,30,5,,https://www.tiktok.com/@thaoni_0111/video/7484487973430430993,7484298468686940161,SỰ NGHIỆP CHƯỚNG,48.6K videos,Pháo Northside🇻🇳,false
thaoni_0111,6954,7481514531408121104,Mỗi chuyến đi là 1 kỉ niệm 💗,2025-03-14 04:17:23,2025-06-05 12:18:46,00:19,9651,191,8,8,13,"hoạtđộngtrảinghiệm, kdllangxanhbentre, truongthcstanphuockhanh",https://www.tiktok.com/@thaoni_0111/video/7481514531408121104,7358828457499773713,nhạc nền - Châu Rim,35.1K videos,Châu Rim,false
thaoni_0111,6954,7473072331745660161,Chúc mừng bóng rổ nam cấp 2 TP.Tân Uyên 🥈🏀💪🏻,2025-02-19 10:17:21,2025-06-05 12:18:59,00:27,6774,117,12,4,5,"bongro🏀, chungket, capcut",https://www.tiktok.com/@thaoni_0111/video/7473072331745660161,7379432426306554641,nhạc nền - mthuy🐣,334 videos,mthuy🐣,false
thaoni_0111,6954,7469377209493409040,Khai xuân thành công 💪🏻💪🏻💪🏻,2025-02-09 11:18:23,2025-06-05 12:19:15,00:57,7087,107,10,8,8,"bongro🏀, tanuyenbinhduong, viralvideo",https://www.tiktok.com/@thaoni_0111/video/7469377209493409040,7324571460323051521,Xin Vía (feat. Freaky & Ngọc Dolil) [MANIFEST],32.4K videos,Bạch Ngọc Anh Thư|Freaky|Ngọc Dolil,false
thaoni_0111,6954,7463800652112645393,Clip trước bị tắt tiếng 😭,2025-01-25 10:38:29,2025-06-05 12:19:28,02:43,12.2K,267,23,27,20,"tết, lantoagiatrixanh, trườngthcstpk",https://www.tiktok.com/@thaoni_0111/video/7463800652112645393,7463800791044721425,nhạc nền - Thảo Ni,1 videos,Thảo Ni,true
thaoni_0111,6954,7454542123602431249,Cảm ơn và tạm biệt 2024….❤️,2024-12-31 11:50:40,2025-06-05 12:19:42,00:14,6758,140,30,3,3,"goodbye2024, newyear2025, nhinlai2024",https://www.tiktok.com/@thaoni_0111/video/7454542123602431249,7453925198207683345,nhạc nền - Em của ngày mới,3568 videos,☆*:.｡. o(グエン・タイ・ソン)o .｡.:*☆,false
thaoni_0111,6954,7452017325277973761,X’mas 🎄,2024-12-24 16:33:10,2025-06-05 12:19:59,00:18,5434,136,36,4,7,"capcut, noel2024🎄",https://www.tiktok.com/@thaoni_0111/video/7452017325277973761,7448827653248912144,nhạc nền - mẹ+coca,12.8K videos,mẹ+coca,false
thaoni_0111,6954,7448612672343477521,Sắp vào đông mà chẳng ai ôm…. 🥴🤭,2024-12-15 12:21:22,2025-06-05 12:20:18,00:17,6537,213,55,26,4,"chill, muadong",https://www.tiktok.com/@thaoni_0111/video/7448612672343477521,7169600079451065114,Sắp vào đông Juky San chưa có bồ,146 videos,Juky San,false
thaoni_0111,6954,7442650205121465601,Lần 2 trường THCS Tân Phước Khánh giành vô địch 🏆 🥇 tại giải bóng chuyền của phòng GD-ĐT Tân Uyên 💪🏻💪🏻💪🏻,2024-11-29 10:43:57,2025-06-05 12:20:34,00:19,10.5K,293,33,20,8,"bongchuyen, vodich, tanphuockhanh",https://www.tiktok.com/@thaoni_0111/video/7442650205121465601,7442655397262985985,nhạc nền - Thảo Ni,1 videos,Thảo Ni,true
