user_name,user_nfollower,vid_id,vid_caption,vid_postTime,vid_scrapeTime,vid_duration,vid_nview,vid_nlike,vid_ncomment,vid_nshare,vid_nsave,vid_hashtags,vid_url,music_id,music_title,music_nused,music_authorName,music_originality
solai.28,1.3M,7477539941178723602,Chếnh kiểu : 🤨🤨🤨,2025-03-03 11:13:57,2025-06-05 18:54:19,00:14,,89.6K,1290,1322,5584,solai,https://www.tiktok.com/@solai.28/video/7477539941178723602,7290135034126666498,nhạc nền - TIGER BRO REMIX,131.7K videos,TIGER BRO REMIX,false
solai.28,1.3M,7476416931550006535,Ghệ tây bắc đáng iu,2025-02-28 10:36:06,2025-06-05 18:54:42,00:24,,64K,1070,684,2861,"solai, thaoxing",https://www.tiktok.com/@solai.28/video/7476416931550006535,7471253536093981456,nhạc nền - Vợ anh nè,202.7K videos,Vịu ơ,false
solai.28,1.3M,7476062395819953416,Suất ngày bị ấy thui may gặp được em nó,2025-02-27 11:40:19,2025-06-05 18:55:12,00:00,,7107,193,89,644,"solai, viemnaglong, follicas, daysungnanglong",https://www.tiktok.com/@solai.28/video/7476062395819953416,7476062551038561040,,,,false
solai.28,1.3M,7475682649244273928,Mỹ nhân nhiều fl nhất têy bắc 🥹,2025-02-26 11:06:42,2025-06-05 18:55:43,00:20,,300.3K,9844,5508,14.3K,solai,https://www.tiktok.com/@solai.28/video/7475682649244273928,7465004458469411601,nhạc nền - cường ₫óm chúa,22.3K videos,cường yêu Việt Nam🇻🇳🇻🇳🇻🇳,false
solai.28,1.3M,7474973788455603464,Chắc như đinh đóng cột rùi chị em,2025-02-24 13:15:58,2025-06-05 18:56:11,00:00,,19.9K,353,184,1221,"solai, pramy, xịtcốđịnhlớptrangđiểm, lockinyourbeauty, pramyloveschipu",https://www.tiktok.com/@solai.28/video/7474973788455603464,7474973999542356753,nhạc nền - solai,1 videos,solai,true
solai.28,1.3M,7473455304974339335,Solai Bình Thường và Solai Siêu Cấp,2025-02-20 11:03:28,2025-06-05 18:56:44,00:14,,93.2K,1268,937,4529,solai,https://www.tiktok.com/@solai.28/video/7473455304974339335,7468852827532643089,,165.5K videos,Jeremiah Custodio,false
angelplay,3.4M,7507573178651249928,Cái gì tới nữa rồi kìa☺️,2025-05-23 09:38:15,2025-06-05 18:57:35,00:52,563.5K,27K,1239,357,1374,"angelplay, playtogethervng, ptgcreator, gamingontiktok",https://www.tiktok.com/@angelplay/video/7507573178651249928,7507573244707687185,nhạc nền - Angel,1 videos,Angel,true
angelplay,3.4M,7507253611014098183,Có ai giống Trồ không 😁,2025-05-22 12:58:10,2025-06-05 18:57:55,01:18,198.1K,11.4K,1155,173,679,"angelplay, playtogethervng, ptgcreator, gamingontiktok",https://www.tiktok.com/@angelplay/video/7507253611014098183,7507253846818442000,nhạc nền - Angel,1 videos,Angel,true
angelplay,3.4M,7506860439020539154,Gì nữa rồi kìa,2025-05-21 11:32:27,2025-06-05 18:58:16,01:21,210.1K,7805,653,318,798,"AngelPlay, gamingontiktok, realmeVN, BacThayChienGame, realme14ChipSnap6Gen4ĐầuTiên, realme14GameMượtPinKhủng, realme14LựaChọnChoGame, tatsumedia",https://www.tiktok.com/@angelplay/video/7506860439020539154,7506860508638300929,,1 videos,Angel,true
angelplay,3.4M,7504949379820932370,Tui làm hình bạn làm tiếng 😁,2025-05-16 07:56:34,2025-06-05 18:58:37,01:14,332.1K,40.7K,767,180,1479,"angelplay, mikeden",https://www.tiktok.com/@angelplay/video/7504949379820932370,7504949410560920337,nhạc nền - Angel,2 videos,Angel,true
angelplay,3.4M,7503520238055492882,Dự đoán điểm thi đồ đó,2025-05-12 11:30:46,2025-06-05 18:59:01,00:23,1.8M,36K,1517,1219,2672,"angelplay, mikeden, playtogethervng, gamingontiktok",https://www.tiktok.com/@angelplay/video/7503520238055492882,7503520262248581905,nhạc nền - Angel,1342 videos,Angel,true
angelplay,3.4M,7502023707754368264,Đại sứ này lạ lắm...,2025-05-08 10:43:28,2025-06-05 18:59:23,00:43,293.4K,20.8K,1244,264,1130,"angelplay, mikeden, playtogethervng, ptgcreator, gamingontiktok",https://www.tiktok.com/@angelplay/video/7502023707754368264,7502023767665806081,nhạc nền - Angel,1 videos,Angel,true
angelplay,3.4M,7501291586123353351,Hiệu trưởng Angel lập đàn cầu điểm thi cho học sinh,2025-05-06 11:22:28,2025-06-05 18:59:45,00:12,2.3M,271.6K,20.6K,97.8K,44.4K,"AngelPlay, MikeDen, playtogethervng, ptgcreator, gamingontiktok",https://www.tiktok.com/@angelplay/video/7501291586123353351,7501291623184157456,nhạc nền - Angel,15 videos,Angel,true
angelplay,3.4M,7500545558491237640,Angel trở thành Đại Sứ,2025-05-04 11:07:30,2025-06-05 19:00:14,00:46,769K,57.5K,2577,832,3859,"AngelPlay, playtogethervng, ptgcreator, gamingontiktok",https://www.tiktok.com/@angelplay/video/7500545558491237640,7500545730398948112,,,Angel,true
angelplay,3.4M,7499810453120437522,Lần sau gặp các bạn Trồ sẽ rủ solo tiếp😆,2025-05-02 11:34:55,2025-06-05 19:00:42,00:59,295K,14.5K,2844,134,976,"AngelPlay, MikeDen, XeKunDuHanh, playtogethervng",https://www.tiktok.com/@angelplay/video/7499810453120437522,7499810656377129744,,,Angel,true
angelplay,3.4M,7499362772162071826,Nhỏ em bỏ tui đi lấy chồng gòi❤️,2025-05-01 06:37:41,2025-06-05 19:01:04,00:18,1.5M,88.2K,3774,721,5502,"angelplay, tuyenxu2003",https://www.tiktok.com/@angelplay/video/7499362772162071826,7499362805179550481,,,Angel,true
angelplay,3.4M,7498713166260473096,Angel mở hộp Nữ Hoàng Bóng Đêm,2025-04-29 12:36:53,2025-06-05 19:01:30,00:45,594.9K,33.1K,14.7K,304,1822,"angelplay, mikeden, playtogethervng, ptgcreator, gamingontiktok",https://www.tiktok.com/@angelplay/video/7498713166260473096,7498713313514212113,nhạc nền - Angel,2 videos,Angel,true
angelplay,3.4M,7498649717690125576,Tính năng bẫy cá trong Play,2025-04-29 08:30:40,2025-06-05 19:01:54,01:09,368.7K,15.7K,2747,525,1157,"AngelPlay, MikeDen, gamingontiktok, playtogethervng, ptgcreator",https://www.tiktok.com/@angelplay/video/7498649717690125576,7498649799382649617,nhạc nền - Angel,1 videos,Angel,true
angelplay,3.4M,7497938744037625095,Có điện thoại mới chơi game rồi.,2025-04-27 10:31:43,2025-06-05 19:02:15,01:18,1.9M,35.4K,1603,2221,4848,"AngelPlay, MikeDen, realme14ChipSnap6Gen4ĐầuTiên, realme14GameMượtPinKhủng",https://www.tiktok.com/@angelplay/video/7497938744037625095,7497938806927264513,nhạc nền - Angel,1 videos,Angel,true
angelplay,3.4M,7497180716204051730,"Hiệu trưởng cỡ đó đó, mà học sinh d.ìm hoài 😑",2025-04-25 09:30:11,2025-06-05 19:02:34,00:13,1.2M,84.5K,5588,2524,7765,"angelplay, mikeden, playtogethervng, ptgcreator, gamingontiktok",https://www.tiktok.com/@angelplay/video/7497180716204051730,7497180746252126993,,49 videos,Angel,true
angelplay,3.4M,7496841993260256520,Angel nghĩ chơi Play vì lý do gì...,2025-04-24 11:35:46,2025-06-05 19:03:02,01:00,466.3K,24.5K,1281,264,1396,"AngelPlay, PlaytogetherVng, gamingontiktok, XeKunDuHanh",https://www.tiktok.com/@angelplay/video/7496841993260256520,7496842048675629841,nhạc nền - Angel,1 videos,Angel,true
angelplay,3.4M,7496484407008660744,Angel Ram Ram😂,2025-04-23 12:28:09,2025-06-05 19:03:23,00:14,1.4M,72.1K,2825,5510,7403,"AngelPlay, MikeDen, Gamingontiktok, PlaytogetherVng, Ptgcreator",https://www.tiktok.com/@angelplay/video/7496484407008660744,7496484442362399505,,,,false
angelplay,3.4M,7495010898675813640,Bác sĩ Angel rất nhẹ nhàng 😁,2025-04-19 13:10:11,2025-06-05 19:04:23,01:09,1.4M,45.4K,1025,1022,3423,"angelplay, mikeden, gamingontiktok, reviewgamehay",https://www.tiktok.com/@angelplay/video/7495010898675813640,7495011126800714513,,,Angel,true
angelplay,3.4M,7494986997325499655,Thử thách này hơi chua,2025-04-19 11:37:26,2025-06-05 19:04:50,02:18,397.3K,9855,611,158,1057,"AngelPlay, Kungalaxy",https://www.tiktok.com/@angelplay/video/7494986997325499655,7494987143937493776,,,,false
angelplay,3.4M,7494636297684798738,Các bạn câu được cá Nhà Táng Mộng Mơ chưa?,2025-04-18 12:56:33,2025-06-05 19:05:18,00:33,229.6K,8633,838,122,569,"AngelPlay, MikeDen, gamingontiktok, playtogethervng, ptgcrrator",https://www.tiktok.com/@angelplay/video/7494636297684798738,7494636353171540752,nhạc nền - Angel,1 videos,Angel,true
oppostore_cilegon,42.5K,7434438202703744312,Tidak cocok untuk orang yang punya kesabaran setipis tisue 😩,2024-11-07 07:37:11,2025-06-05 19:05:58,00:20,4883,76,0,Share,6,"fyp, oppobillionbeats, promotor",https://www.tiktok.com/@oppostore_cilegon/video/7434438202703744312,7180712323396340506,original sound - 𝘿𝙄𝙇🎧,48.1K videos,𝘿𝙄𝙇🎧,false
oppostore_cilegon,42.5K,7434441834060877111,Tiap hari kok galau mulu 😌,2024-11-07 07:51:17,2025-06-05 19:06:24,,5481,76,4,2,3,"fyp, lucu, oppobillionbeats",https://www.tiktok.com/@oppostore_cilegon/photo/7434441834060877111,7320960545753107206,suara asli - infoinnostalgia,16.8K videos,infoinnostalgia,false
oppostore_cilegon,42.5K,7434444019775655224,Ga mungkin dong sobat oppo 😍,2024-11-07 07:59:46,2025-06-05 19:06:46,00:09,6669,124,4,2,7,"oppobillionbeats, promotor, fyp",https://www.tiktok.com/@oppostore_cilegon/video/7434444019775655224,7411810577825499905,suara asli - Sirri Clinic,69 videos,Sirri Clinic,false
oppostore_cilegon,42.5K,7476832207198227730,Pilihan warna Reno 13 series bikin ngiler🤪,2025-03-01 13:27:35,2025-06-05 19:07:07,00:22,11.2K,254,12,73,35,"oppoindonesia, opporeno13series, oppobillionbeats, fypシ, opposelfie",https://www.tiktok.com/@oppostore_cilegon/video/7476832207198227730,7331038265292245765,,746.8K videos,GREAT Alpha 🇮🇩,false
oppostore_cilegon,42.5K,7476836182966504722,"Oppo find x8, take foto tanpa delay dan blur💅🏻",2025-03-01 13:43:00,2025-06-05 19:07:33,00:29,8252,211,11,8,26,"oppofindx8, oppoindonesia, oppo, oppobillionbeats, opposelfie, oppogifchallenge, oppogifchallenge",https://www.tiktok.com/@oppostore_cilegon/video/7476836182966504722,7248175565935840002,La La La - Sped Up Version,4.1M videos,Sam Smith,false
oppostore_cilegon,42.5K,7476836183465823506,Pre Order Oppo A5 pro 🫶🏻,2025-03-01 13:43:01,2025-06-05 19:08:00,00:08,557.1K,7841,126,236,545,"oppoa5pro, oppoa95performaandalanmu, oppotahanbanting, oppotahanair, oppoindonesia, opposelfie, oppobillionbeats",https://www.tiktok.com/@oppostore_cilegon/video/7476836183465823506,7408901381920180998,suara asli - @senafestive,2603 videos,@senafestive,false
oppostore_cilegon,42.5K,7476838418392075528,"XT-X10E Reoqoo Indoor Camera, new product by Oppo💚",2025-03-01 13:51:41,2025-06-05 19:08:27,00:43,6901,94,2,Share,3,"oppobillionbeats, cctvcamera, cctv, oppoindonesia, oppogifchallenge, oppochallenge",https://www.tiktok.com/@oppostore_cilegon/video/7476838418392075528,7331038265292245765,i dont know WHY 2024 Private mix,746.8K videos,GREAT Alpha 🇮🇩,false
oppostore_cilegon,42.5K,7477215877184621842,"Si cantik Oppo A5 pro,  Pre Order Now😍",2025-03-02 14:16:25,2025-06-05 19:08:48,00:14,18.6K,529,18,45,40,"jjcapcut, oppo, oppobillionbeats, opposelfie, oppogifchallenge, oppochallenge, oppoa5pro, oppoa5pro5g",https://www.tiktok.com/@oppostore_cilegon/video/7477215877184621842,7331038265292245765,i dont know WHY 2024 Private mix,746.8K videos,GREAT Alpha 🇮🇩,false
oppostore_cilegon,42.5K,7480065649931324679,"Coba dulu ikutan Pre Order Oppo A5pro di Oppo Store Cilegon Center Mall, kamu bisa dapetin banyak keuntungannya 🤪",2025-03-10 06:34:59,2025-06-05 19:09:09,00:17,147.5K,5850,84,219,915,"oppo, oppoindonesia, opposelfie, oppoa5pro, oppoa5pro5g, oppobillionbeats, oppogifchallenge, cilegon, jjcapcut",https://www.tiktok.com/@oppostore_cilegon/video/7480065649931324679,7474952631371205377,suara asli - Apasajasemogasukses,35.9K videos,Bidan Cantik_27,false
oppostore_cilegon,42.5K,7480771922674912520,Hidupkan moment terbaikmu bersama Oppo A5 pro dengan fitur AI livephoto,2025-03-12 04:15:41,2025-06-05 19:09:33,00:22,1.2M,37.6K,547,1244,4170,"oppo, opposelfie, oppobillionbeats, oppogifchallenge, oppoa5pro, oppoa5pro5g, oppoa5pro4g, ailivephoto",https://www.tiktok.com/@oppostore_cilegon/video/7480771922674912520,7477494651771996933,suara asli - Moonlight💫,714.8K videos,Moonlight✨,false
oppostore_cilegon,42.5K,7486023773515156743,Oppo A5 pro nih boss🫵🏻,2025-03-26 07:55:33,2025-06-05 19:10:02,00:38,12.1K,328,11,3,28,"oppo, oppobillionbeats, opposelfie, oppoa95performaandalanmu, oppogifchallenge, oppoa5pro, oppoa5pro5g, oppoa5procase, oppoindonesia",https://www.tiktok.com/@oppostore_cilegon/video/7486023773515156743,7387573619378046993,AURA,2.7M videos,𝙊𝙜𝙧𝙮𝙯𝙚𝙠 🇵🇱🌍,false
oppostore_cilegon,42.5K,7486027894448262407,"Tampilan jadi lebih menawarn dengan promo free woven fiber magnetic case untuk setiap pembelian Oppo Find X8, promo berlaku sampai tanggal 31 Maret yaa O-Fans😚",2025-03-26 08:11:33,2025-06-05 19:10:31,00:26,7716,229,3,2,17,"oppo, oppobillionbeats, opposelfie, oppofindx8, oppofindx8series, oppoindonesia, oppogifchallenge, opportunity",https://www.tiktok.com/@oppostore_cilegon/video/7486027894448262407,7409574559731895045,suara asli - lintang27,1.4M videos,lintang27,false
oppostore_cilegon,42.5K,7486030385608936712,"Marhaban ya ramadhan, nikmati promo ramadhan untuk setiap pembelian Oppo Reno 13F series free exclusive phone case menarik dari Oppo💅🏻",2025-03-26 08:21:13,2025-06-05 19:10:55,00:27,13.1K,337,13,10,19,"oppobillionbeats, oppo, oppoindonesia, oppoindonesia💚💚💚, opporeno13series, opporeno13, opposelfie",https://www.tiktok.com/@oppostore_cilegon/video/7486030385608936712,7073353724134950914,,,,false
oppostore_cilegon,42.5K,7486372202955148551,Lengkapi kebutuhan smartphonemu dengan Oppo Reno 13 5G🫶🏻,2025-03-27 06:27:38,2025-06-05 19:11:20,00:53,8207,376,13,18,23,"oppo, oppobillionbeats, oppoindonesia, oppoindonesia💚💚💚, opposelfie, oppoa95performaandalanmu, opporeno7portrait, oppogifchallenge, opporeno13series, opporeno135g",https://www.tiktok.com/@oppostore_cilegon/video/7486372202955148551,7231091243878795265,Come Check This (Quickie Edit),4.4M videos,FETISH,false
oppostore_cilegon,42.5K,7495325291951197447,Wut wut wut wut Find N5 ikutan trend nihhh🤪,2025-04-20 09:30:12,2025-06-05 19:11:50,00:20,4923,199,6,8,10,"oppo, oppoindonesia, oppobillionbeats, oppofindn5, opposelfie, oppogifchallenge",https://www.tiktok.com/@oppostore_cilegon/video/7495325291951197447,7493528484888365879,ind,1.3M videos,chraishnov,false
oppostore_cilegon,42.5K,7495327018100313362,"Oppo Find N5, Pre Order Now!!!",2025-04-20 09:36:54,2025-06-05 19:12:13,,5108,175,0,8,12,"oppo, oppoindonesia, oppobillionbeats, opposelfie, oppofindn5, oppobillionbeats, foldablephone",https://www.tiktok.com/@oppostore_cilegon/photo/7495327018100313362,7485367835679558417,,,,false
oppostore_cilegon,42.5K,7497582913903627538,"Wut wut wut, Mau buka 3 aplikasi diwaktu yang sama? Oppo Find N5 solusinya🤪",2025-04-26 11:30:55,2025-06-05 19:12:39,00:28,3932,133,2,5,12,"oppo, oppobillionbeats, opposelfie, oppogifchallenge, oppofindn5, oppofindn5unboxing, wutwutwutwut",https://www.tiktok.com/@oppostore_cilegon/video/7497582913903627538,7496049862636341249,,,,false
oppostore_cilegon,42.5K,7497583738193284359,Pre Order Now! Oppo Find N5,2025-04-26 11:34:07,2025-06-05 19:13:07,00:20,7323,266,11,18,6,"oppo, opposelfie, oppoindonesia, oppoindo, oppoaiphone, oppofind, oppofindn5, oppogifchallenge, opportunity",https://www.tiktok.com/@oppostore_cilegon/video/7497583738193284359,7437830136097033015,,,,false
oppostore_cilegon,42.5K,7499454570129624328,Koleksi Ollie elemental di Oppo Store terdekat kamu🥰,2025-05-01 12:33:54,2025-06-05 19:13:38,,2655,69,3,Share,2,"oppo, opposelfie, ollie, oppoindonesia, oppogifchallenge",https://www.tiktok.com/@oppostore_cilegon/photo/7499454570129624328,7402276812891458310,suara asli - astrooo🪐,381K videos,astrooo🪐,false
oppostore_cilegon,42.5K,7499456246408285458,Butuh charm buat di tas? Beli aja Ollie Earphone bag yang super duper imuttt ini😍,2025-05-01 12:40:24,2025-06-05 19:14:03,00:21,3097,110,1,Share,2,"oppo, opposelfie, ollie, oppoindonesia, oppogifchallenge",https://www.tiktok.com/@oppostore_cilegon/video/7499456246408285458,7469810316273093382,NAN KO PAHAM FULL NYA DI YOUTUBE RAKA REMIXER,2M videos,Raka Remixer,false
hongmahongma,53.4K,7491343551335288072,omg cái vibe kìaaa,2025-04-09 15:59:00,2025-06-05 19:14:38,00:18,202.9K,9929,62,663,612,"pamyeuoi, chuyennhadau, đậu, pamđậu, pamvadau",https://www.tiktok.com/@hongmahongma/video/7491343551335288072,7491343581060352784,nhạc nền - Pam Yêu Ơi 🌺,1 videos,Pam Yêu Ơi 🌺,true
hongmahongma,53.4K,7491207504844557576,Hong Hae Pamm,2025-04-09 07:11:05,2025-06-05 19:15:09,00:17,1.7M,158.8K,335,7959,5413,"pamyeuoi, pammatvuong, chuyennhadau, đậu, pamđậu",https://www.tiktok.com/@hongmahongma/video/7491207504844557576,7491207528181664513,nhạc nền - Pam Yêu Ơi 🌺,879 videos,Pam Yêu Ơi 🌺,true
hongmahongma,53.4K,7490988584204291336,góc nghiêng của cổ😭😭,2025-04-08 17:01:33,2025-06-05 19:15:33,00:16,95.1K,9951,28,553,443,"pamyeuoi, pammatvuong, pamđậu, chuyennhadau, đậu",https://www.tiktok.com/@hongmahongma/video/7490988584204291336,7490988613539318544,nhạc nền - Pam Yêu Ơi 🌺,1 videos,Pam Yêu Ơi 🌺,true
hongmahongma,53.4K,7490982928411938056,"cục pam, mắt lúc nào cũng tròn xoee cưng 🫶🏻🫶🏻",2025-04-08 16:39:36,2025-06-05 19:15:56,00:22,504.8K,58.5K,168,3377,2319,"pamyeuoi, pammatvuong, pamela, pamđậu",https://www.tiktok.com/@hongmahongma/video/7490982928411938056,7490982981517216513,nhạc nền - Pam Yêu Ơi 🌺,8 videos,Pam Yêu Ơi 🌺,true
hongmahongma,53.4K,7490613114937871623,đẹp trai &giỏi ngoại ngữ 🫶🏻🫶🏻,2025-04-07 16:44:32,2025-06-05 19:16:21,00:21,367.7K,31.9K,104,3076,1098,"PamYeuOi, ChuyenNhaDau, Đậu, PamĐậu",https://www.tiktok.com/@hongmahongma/video/7490613114937871623,7490613145812224785,nhạc nền - Pam Yêu Ơi 🌺,1 videos,Pam Yêu Ơi 🌺,true
hongmahongma,53.4K,7490111010557152517,Tuyệt đối điện ảnh 🫵🏻🫵🏻,2025-04-06 08:16:07,2025-06-05 19:16:44,00:20,95.8K,5226,35,253,518,"pamyeuoi, chuyennhadau, đậu, pamđậu, honghaepam",https://www.tiktok.com/@hongmahongma/video/7490111010557152517,7490111018664905527,nhạc nền - Pam Yêu Ơi 🌺,1 videos,Pam Yêu Ơi 🌺,true
hongmahongma,53.4K,7489907291961953541,gọi cổ là Hong Hae Pam cũng phải,2025-04-05 19:05:35,2025-06-05 19:17:09,00:22,614.7K,47.1K,204,4772,2020,"pamyeuoi, pammatvuong, pamđậu",https://www.tiktok.com/@hongmahongma/video/7489907291961953541,7489907284191693574,nhạc nền - Pam Yêu Ơi 🌺,2 videos,Pam Yêu Ơi 🌺,true
hongmahongma,53.4K,7489725150951116087,Trùm cúp học va phải học bá=)))),2025-04-05 07:18:47,2025-06-05 19:17:32,00:18,622.4K,46.7K,175,3791,985,"pamyeuoi, chuyennhadau, đậu, pamđậu",https://www.tiktok.com/@hongmahongma/video/7489725150951116087,7489725144971053879,nhạc nền - Pam Yêu Ơi 🌺,2 videos,Pam Yêu Ơi 🌺,true
hongmahongma,53.4K,7489680081443360055,Nguyễn Gia Huy-Trần Gia Huy=)))),2025-04-05 04:23:54,2025-06-05 19:17:59,00:15,428.3K,35.4K,170,2798,1660,"pamyeuoi, chuyennhadau, đậu, xoài, xoaifamily, xoaifam, pamđậu",https://www.tiktok.com/@hongmahongma/video/7489680081443360055,7489680066340719366,,,Pam Yêu Ơi 🌺,true
hongmahongma,53.4K,7489655022821707063,Đậuuu 😍,2025-04-05 02:46:39,2025-06-05 19:18:26,00:17,1.2M,95.8K,361,2969,4055,"pamyeuoi, chuyennhadau, đậu, pamđậu",https://www.tiktok.com/@hongmahongma/video/7489655022821707063,7489655019176872710,,,Pam Yêu Ơi 🌺,true
hongmahongma,53.4K,7488596370933157126,iu thee,2025-04-02 06:18:33,2025-06-05 19:18:51,00:23,46.3K,3483,9,232,201,"pamyeuoi, chuyennhadau, đậu, mevangnhabalasieunhan2025, pamđậu, pammatvuong",https://www.tiktok.com/@hongmahongma/video/7488596370933157126,7488596368899017527,nhạc nền - Pam Yêu Ơi 🌺,1 videos,Pam Yêu Ơi 🌺,true
hongmahongma,53.4K,7488361235197578501,7749 kịch bản trong đầu=))),2025-04-01 15:06:06,2025-06-05 19:19:18,00:18,592.8K,30.8K,145,1136,1962,"pamyeuoi, chuyennhadau, đậu, mevangnhabalasieunhan2025, pamđậu",https://www.tiktok.com/@hongmahongma/video/7488361235197578501,7488361254652906246,nhạc nền - Pam Yêu Ơi 🌺,5 videos,Pam Yêu Ơi 🌺,true
hongmahongma,53.4K,7484436056440327442,,2025-03-22 01:14:24,2025-06-05 19:19:50,00:17,676.5K,37K,269,4716,1030,"pamyeuoi, pammatvuong, pamelahaiduong",https://www.tiktok.com/@hongmahongma/video/7484436056440327442,7484436095011277585,,,Pam Yêu Ơi 🌺,true
hongmahongma,53.4K,7480827631961640199,F4 Việt Nam=))),2025-03-12 07:51:52,2025-06-05 19:20:19,00:15,,63.2K,83,2073,2024,"pamyeuoi, salim, hailong, limlonglastinglove, ninhduongstory",https://www.tiktok.com/@hongmahongma/video/7480827631961640199,7480827692620368656,nhạc nền - Pam Yêu Ơi 🌺,7 videos,Pam Yêu Ơi 🌺,true
hongmahongma,53.4K,7479764242720115986,nhỏ em thắng đời 1-0 khi được dự đám cưới của ba mẹe💍,2025-03-09 11:05:23,2025-06-05 19:20:50,00:16,,6553,11,143,242,"pamyeuoi, salim, hailong, limlonglastinglove, salimhailong",https://www.tiktok.com/@hongmahongma/video/7479764242720115986,7479764300643568401,,,Pam Yêu Ơi 🌺,true
hongmahongma,53.4K,7479498823933496592,"""Anh sợ làm em bị tổn thương"" eo ơi dth vch",2025-03-08 17:55:25,2025-06-05 19:21:10,00:23,,43.3K,203,4728,2289,"salim, pamyeuoi, hailong, tinhyeu",https://www.tiktok.com/@hongmahongma/video/7479498823933496592,7479499130000296721,nhạc nền - Pam Yêu Ơi 🌺,8 videos,Pam Yêu Ơi 🌺,true
hongmahongma,53.4K,7479480359487409424,Khóc trong sự hạnh phúcc 👩‍❤️‍👨,2025-03-08 16:43:46,2025-06-05 19:21:32,00:20,,51.3K,48,1746,2125,"salim, hailong, pamyeuoi, pam",https://www.tiktok.com/@hongmahongma/video/7479480359487409424,7479480556934204177,nhạc nền - Pam Yêu Ơi 🌺,36 videos,Pam Yêu Ơi 🌺,true
hongmahongma,53.4K,7479324277238484240,Cô bé masha và chú gấu xiếc,2025-03-08 06:38:05,2025-06-05 19:21:54,00:19,,22.6K,5,521,456,"pamyeuoi, pammatvuong, hailong",https://www.tiktok.com/@hongmahongma/video/7479324277238484240,7479324511746280208,nhạc nền - Pam Yêu Ơi 🌺,2 videos,Pam Yêu Ơi 🌺,true
hongmahongma,53.4K,7479064053546011921,"""Một nhà đình nhỏ, một hạnh phúc to"" 🏠❤️",2025-03-07 13:48:17,2025-06-05 19:22:13,00:23,,130.9K,195,8947,3997,"pamyeuoi, pammatvuong, hatnhaifamily",https://www.tiktok.com/@hongmahongma/video/7479064053546011921,7479064200682162961,nhạc nền - Pam Yêu Ơi 🌺,7 videos,Pam Yêu Ơi 🌺,true
hongmahongma,53.4K,7478419645247048977,,2025-03-05 20:07:39,2025-06-05 19:22:34,00:18,,17.7K,11,890,392,"pamyeuoi, pammatvuong, hailong",https://www.tiktok.com/@hongmahongma/video/7478419645247048977,7478419833332878096,nhạc nền - Pam Yêu Ơi 🌺,1 videos,Pam Yêu Ơi 🌺,true
.27_th08,7755,7489893862522080567,"""Mỗi bước đi dù chậm chạp, cũng đang đưa mình đến gần phiên bản tốt đẹp hơn.",2025-04-05 18:13:28,2025-06-05 19:23:03,00:45,3488,79,2,3,22,"douyin抖音, piano, chill, timemachine, 七啊, 氛围感, 27th08, xuhuong, tiktok, tamtrang",https://www.tiktok.com/@.27_th08/video/7489893862522080567,7489893877547518775,nhạc nền - 27_th08,1 videos,27_th08,true
.27_th08,7755,7490034597217045766,"""听旧曲，不是沉溺过去，而是学会和回忆握手言和。""",2025-04-06 03:19:36,2025-06-05 19:23:24,00:33,1391,26,1,3,2,"douyin抖音, kiuc, xuhuong, andrés, unama, 旧曲重听，优雅依旧, nhachaymoingay, 27th08, trending, piano",https://www.tiktok.com/@.27_th08/video/7490034597217045766,7490034603248372486,nhạc nền - 27_th08,1 videos,27_th08,true
.27_th08,7755,7490168106334096645,"Nếu cảm xúc của bạn là một bản nhạc, nó sẽ như thế nào?",2025-04-06 11:57:41,2025-06-05 19:23:43,00:47,1548,25,0,1,2,"trending, douyin抖音, callofsilence, 27th08, tamtrang, trending",https://www.tiktok.com/@.27_th08/video/7490168106334096645,7490168122813565702,nhạc nền - 27_th08,1 videos,27_th08,true
.27_th08,7755,7490396075325410566,Bạn là ai ?,2025-04-07 02:42:19,2025-06-05 19:24:08,00:44,2006,60,6,3,3,"trending, douyin抖音, tamtrang, nhacnaychillphet, viral",https://www.tiktok.com/@.27_th08/video/7490396075325410566,7490396090841139974,nhạc nền - 27_th08,1 videos,27_th08,true
.27_th08,7755,7490735166596467976,"“Có những thứ đẹp như sứ men lam… chỉ để nhìn, không thể giữ.”|Tên nhạc:Thanh hoa (青花)",2025-04-08 00:38:10,2025-06-05 19:24:35,00:51,2209,44,0,Share,2,"music, douyin抖音, nhactrungquoc, 27th08, xuhuong, trending, 青花",https://www.tiktok.com/@.27_th08/video/7490735166596467976,7490735229032778512,nhạc nền - 27_th08,1 videos,27_th08,true
.27_th08,7755,7490933674200927495,"""Có những ngày bình yên đến lạ... không phải vì mọi thứ đều ổn, mà là vì mình học cách im lặng với những điều không thể thay đổi.""",2025-04-08 13:28:28,2025-06-05 19:25:04,00:24,2134,71,1,7,8,"douyin抖音, binhyen, trending, nhacnaychillphet, xuhuong, music, 27th08",https://www.tiktok.com/@.27_th08/video/7490933674200927495,7490933707713317649,,,27_th08,true
.27_th08,7755,7491103556305423634,“Tuyệt vọng không phải vì mọi thứ kết thúc… mà là vì chẳng còn lý do để bắt đầu lại.”,2025-04-09 00:27:42,2025-06-05 19:25:26,00:12,2179,66,1,8,6,"douyin抖音, music, 27th08, tamtrang, trending, xuhuong",https://www.tiktok.com/@.27_th08/video/7491103556305423634,7491103584239504144,nhạc nền - 27_th08,1 videos,27_th08,true
.27_th08,7755,7491294024129645832,Hãy thưởng thức,2025-04-09 12:46:49,2025-06-05 19:25:52,00:27,2465,160,2,12,24,"nhacnaychillphet, 27th08, music, douyin抖音, xuhuong, 请你别走太快",https://www.tiktok.com/@.27_th08/video/7491294024129645832,7491294053749771025,nhạc nền - 27_th08,2 videos,27_th08,true
